{
  "rule_id": "us-tx-tceq-construction-stormwater-cgp",
  "version": "1.0.0",
  "title": "TCEQ Construction Stormwater CGP",
  "permit_name": "Texas Pollutant Discharge Elimination System Construction General Permit",
  "permit_code": "TXR150000",
  "jurisdiction_level": "state",
  "jurisdiction_id": "us-tx",
  "source_agency": "Texas Commission on Environmental Quality",
  "applicable_project_types": [
    "transmission_line",
    "substation",
    "utility_corridor",
    "roadside_utility",
    "linear_general"
  ],
  "confidence_tier": 1,
  "provenance": {
    "source_citations": [
      {
        "citation_type": "website",
        "reference": "Stormwater General Permit for Construction Activities",
        "url": "https://www.tceq.texas.gov/permitting/stormwater/construction",
        "retrieved_at": "2026-05-25"
      },
      {
        "citation_type": "agency_guidance",
        "reference": "Stormwater Discharges from Construction Activities: Am I Regulated?",
        "url": "https://www.tceq.texas.gov/permitting/stormwater/construction/TXR15_AIR.html",
        "retrieved_at": "2026-05-25"
      },
      {
        "citation_type": "form",
        "reference": "2023 Construction General Permit TXR150000",
        "url": "https://www.tceq.texas.gov/downloads/permitting/stormwater/general/construction/2023-cgp-txr150000.pdf/%40%40download/file/2023-cgp-txr150000.pdf",
        "retrieved_at": "2026-05-25"
      }
    ],
    "last_verified": "2026-05-25",
    "reviewer": "OpenAI Deep Research"
  },
  "status": "draft",
  "triggers": {
    "all": [
      {
        "field": "project.stormwater_discharge_to_surface_water",
        "operator": "=",
        "value": true
      },
      {
        "any": [
          {
            "field": "project.disturbed_acres",
            "operator": ">=",
            "value": 1
          },
          {
            "field": "derived.common_plan_total_disturbed_acres",
            "operator": ">=",
            "value": 1
          }
        ]
      }
    ]
  },
  "outputs": {
    "permits": [
      {
        "name": "Texas Pollutant Discharge Elimination System Construction General Permit",
        "agency": "Texas Commission on Environmental Quality",
        "code": "TXR150000"
      }
    ],
    "agencies": [
      "Texas Commission on Environmental Quality"
    ]
  },
  "explanations": {
    "trigger_explanation": "Construction activity that discharges stormwater to surface water in the state and disturbs at least one acre, or is part of a larger common plan totaling at least one acre, commonly triggers the Texas construction stormwater general permit."
  },
  "known_unknowns": [
    "Local erosion and sediment controls may apply in addition to the state general permit."
  ],
  "advisories": [
    "Additional review recommended for linear projects that segment construction because a common plan can aggregate disturbed acreage."
  ],
  "tags": [
    "stormwater",
    "disturbance_threshold",
    "swp3",
    "state"
  ],
  "notes": "Confidence tier 1 because the acreage trigger and current permit identifier are directly published by the Texas Commission on Environmental Quality."
}
