{
  "rule_id": "us-tx-municipality-austin-right-of-way-permit",
  "version": "1.0.0",
  "title": "Austin right-of-way permit",
  "permit_name": "Right-of-Way Permit",
  "jurisdiction_level": "municipality",
  "jurisdiction_id": "us-tx-municipality-austin",
  "source_agency": "City of Austin Transportation and Public Works Department",
  "applicable_project_types": [
    "transmission_line",
    "substation",
    "utility_corridor",
    "roadside_utility",
    "linear_general"
  ],
  "confidence_tier": 2,
  "provenance": {
    "source_citations": [
      {
        "citation_type": "website",
        "reference": "Right-of-Way Permits",
        "url": "https://www.austintexas.gov/transportation-public-works/right-way-row-permits",
        "retrieved_at": "2026-05-27"
      }
    ],
    "last_verified": "2026-05-27",
    "reviewer": ""
  },
  "status": "draft",
  "triggers": {
    "any": [
      {
        "field": "project.municipal_row_use",
        "operator": "=",
        "value": true
      },
      {
        "field": "project.utility_row_crossings_count",
        "operator": ">",
        "value": 0
      }
    ]
  },
  "outputs": {
    "permits": [
      {
        "name": "Right-of-Way Permit",
        "agency": "City of Austin Transportation and Public Works Department"
      }
    ]
  },
  "explanations": {
    "trigger_explanation": "Use of Austin public right-of-way for utility, transportation, or construction activity likely needs a right-of-way permit."
  },
  "known_unknowns": [],
  "advisories": [
    "Inspection, usage, and application fees vary by permit type and activity."
  ],
  "tags": [
    "right_of_way",
    "austin",
    "utility"
  ],
  "notes": "Tier 2: official city right-of-way permit page verifies the permit framework; exact permit class depends on the work type."
}
